Размер,Адрес,Точен адрес,Цена,Валута,Обзавеждане,Етаж,Етажи,Отопление,Състояние,Строителство,Спални,Бани,Двор,Площ на парцела,В регулация,Предназначение,Виза,Разрешение за строеж,Категория,Тип,Oписание
65m²,"жк. Надежда 2, София",True,"106,095",EUR,Обзаведен,3-ти,,Електричество,,Тухла,,,,,,,,,,,"➡️Тристаен апартамент в район Надежда 2.
Състои се от голям хол, отделен кухненски бокс, спалня, детска стая с две легла, баня и самостоятелна тоалетна.

✔️За повече информация и оглед се свържете с нас!

Имотът може да бъде резервиран и свален от продажба със заплащане на депозит, след което се прекратява провеждането на огледи с други купувачи и започва подготовка на документите за сключване на предварителен и окончателен договор.
Допълнителни услуги и следпродажбено обслужване
Ние сме реномирана компания и ще бъдем с вас не само по време на покупката, но и след това, осигурявайки ви допълнителни услуги по ваше изискване с цел пълноценно и безпроблемно ползване на новозакупения имот. Услугите, които можем да предложим, включват получаване на одобрение за ипотечен кредит, застраховка на движимо и недвижимо имущество, строителни и ремонтни дейности, обзавеждане, юридически и счетоводни услуги и др.

Реф. номер: 37456"
123m²,"жк. Надежда 2, София",True,"194,000",EUR,Обзаведен,6-ти,8,Електричество,,Тухла,,,,,,,,,,,"Реф. номер: 36673

Аякс Имоти има удоволствието да Ви представи многостаен апартамент в район Надежда 2. Апартамента се състои от дневна с кухня и трапезария, 2 спални, баня с тоалетна, тоалетна, два балкона и мазе с обща площ 123 кв.м. За повече информация и оглед се свържете с нас!

Имотът може да бъде резервиран и свален от продажба със заплащане на депозит, след което се прекратява провеждането на огледи с други купувачи и започва подготовка на документите за сключване на предварителен и окончателен договор.
Допълнителни услуги и следпродажбено обслужване
Ние сме реномирана компания и ще бъдем с вас не само по време на покупката, но и след това, осигурявайки ви допълнителни услуги по ваше изискване с цел пълноценно и безпроблемно ползване на новозакупения имот. Услугите, които можем да предложим, включват получаване на одобрение за ипотечен кредит, застраховка на движимо и недвижимо имущество, строителни и ремонтни дейности, обзавеждане, юридически и счетоводни услуги и др."
76m²,"жк. Надежда 2, София",True,"165,000",EUR,Обзаведен,4-ти,5,Електричество,,Тухла,,,,,,,,,,,"АЯКС Ви представя страхотен тристаен апартамент кв. Надежда 2. Ситуиран е на 4ти жилищен етаж и разполага с площ от 76кв.м.
Разпределение:вх. антре, дневна с кухненски бокс, две спални помещения и баня с тоалетна.

Покупката на жилище е изключително важен момент от живота на всеки човек и за това искаме да предложим най- доброто. Услугите, които можем да предложим, включват:
Получаване на одобрение за ипотечен кредит.
Застраховка на движимо и недвижимо имущество.
Строителни ,ремонтни дейности и изготвяне на 3-д интериорен дизайн , за да си представите как би изглеждал вашия мечтан дом
Юридически и счетоводни услуги и др.

За удобство на клиента, екипът ни е договорил с нашите финансови партньори преференциални условия за банков кредит.

При интерес към този или друг имот се свържете с нас за повече информация, безплатна консултация или уговорка за оглед.

Референтен номер:195763"
82m²,"жк. Надежда 2, София",True,"161,733",EUR,Необзаведен,1-ви,4,ТЕЦ,,Тухла,,,,,,,,,,,"Ние от Хевън Хоумс Ви представяме двустаен апартамент на повече от прекрасна локация в жк. Надежда 2. Състоящо се от: входно антре, всекидневна с кухненски бокс и трепезария, спалня, баня с тоалетна, две тераси. Сградата има АКТ 16. Отоплението е на ТЕЦ. Строителство - 2022 година. РЗП: 82,9 кв.м. Троен стъклопакет, 5 камерна дограма. Ако имотът представлява интерес за Вас, моля свържете се с нас на +359 895307021 и посочете референтен номер: 36731"
107m²,"жк. Надежда 2, София",False,"150,114",EUR,,Партер,6,,,Тухла,,,,,,,,,,,"Явлена - Изток предлага за продажба светъл и просторен тристаен апартамент в комплекс от затворен тип в комуникативен район. Апартаментът е разположен на втори етаж в сграда, част от комплекса и с Акт 14. В близост има спирка на градски транспорт, бъдеща спирка на метростанция, магазини и бърз достъп до центъра на столицата. Апартаментът е с площ от 106,87 кв.м., от които ЗП 96,50 кв.м. Разпределението е както следва: входно антре, всекидневна с кухненски бокс, две спални, санитарен възел и тераса. Модерно и качествено строително изпълнение с висок клас материали. Отоплението е на газ. Изложението на имота е: юг, изток и запад.  Има възможност за покупка на гараж срещу допълнителна цена. В сградата се предлагат и други апартаменти."
107m²,"жк. Надежда 2, София",False,"150,114",EUR,,3-ти,6,,,Тухла,,,,,,,,,,,"Явлена - Изток предлага за продажба светъл и просторен тристаен апартамент в комплекс от затворен тип в комуникативен район. Апартаментът е разположен на трети етаж в сграда, част от комплекса и с Акт 14. В близост има спирка на градски транспорт, бъдеща спирка на метростанция, магазини и бърз достъп до центъра на столицата. Апартаментът е с площ от 106,87 кв.м., от които ЗП 96,50 кв.м. Разпределението е както следва: входно антре, всекидневна с кухненски бокс, две спални, санитарен възел и тераса. Модерно и качествено строително изпълнение с висок клас материали. Отоплението е на газ. Изложението на имота е: юг, изток и запад. Има възможност за покупка на гараж срещу допълнителна цена. В сградата се предлагат и други апартаменти."
92m²,"жк. Надежда 2, София",False,"139,458",EUR,,6-ти,6,,,Тухла,,,,,,,,,,,"Явлена - Изток предлага за продажба светъл и слънчев двустаен апартамент в комплекс от затворен тип в комуникативен район. Апартаментът е разположен на шести (последен) етаж в сграда, част от комплекса с Акт 14. В близост има спирка на градски транспорт, бъдеща спирка на метростанция, магазини и бърз достъп до центъра на столицата. Апартаментът е с площ от 91,81 кв.м., от които ЗП 82,90 кв.м. Разпределението е както следва: входно антре, всекидневна с кухненски бокс, спалня, санитарен възел и тераса. Модерно и качествено строително изпълнение с висок клас материали. Отоплението е на газ, западно изложение. Има възможност за покупка на гараж срещу допълнителна цена. В сградата се предлагат и други апартаменти."
65m²,"жк. Надежда 2, София",False,"91,900",EUR,,3-ти,8,ТЕЦ,,Панел,,,,,,,,,,,"Просторен двустаен апартамент, находящ се на много комуникативно място на метри от верига магазини, детска градина, спирки на градски транспорт и на пешеходно разстояние от метростанция ,,Надежда"". Жилището се състои от кухня с остъклен балкон, спалня, хол с остъклен балкон, баня с тоалетна и коридор. Среден етаж, добре поддържан вход. Изложение: изток, запад."
61m²,"жк. Надежда 2, София",False,"95,600",EUR,,1-ви,6,,,Тухла,,,,,,,,,,,"Явлена - Изток предлага за продажба светъл и слънчев двустаен апартамент в комплекс от затворен тип в комуникативен район. Апартаментът е разположен на партерен етаж с двор към него в сграда, част от комплекса с Акт 14. В близост има спирка на градски транспорт, бъдеща спирка на метростанция, магазини и бърз достъп до центъра на столицата. Апартаментът е с площ от 61,46 кв.м., от които ЗП 55,50 кв.м. Към жилището има прилежащ двор с площ от 15 кв.м и мазе - 2,9 кв.м. Разпределението е както следва: входно антре, всекидневна с кухненски бокс, спалня и двор. Модерно и качествено строително изпълнение с висок клас материали. Отоплението е на газ, западно изложение. Има възможност за покупка на гараж срещу допълнителна цена. В сградата се предлагат и други апартаменти."
62m²,"жк. Надежда 2, София",False,"92,815",EUR,,2-ри,6,,,Тухла,,,,,,,,,,,"Явлена - Изток предлага за продажба светъл и слънчев двустаен апартамент в комплекс от затворен тип в комуникативен район. Апартаментът е разположен на втори етаж в сграда, част от комплекса с Акт 14. В близост има спирка на градски транспорт, бъдеща спирка на метростанция, магазини и бърз достъп до центъра на столицата. Апартаментът е с площ от 61,69 кв.м., от които ЗП 55,70 кв.м. Разпределението е както следва: входно антре, всекидневна с кухненски бокс, спалня, санитарен възел и тераса. Модерно и качествено строително изпълнение с висок клас материали. Отоплението е на газ, западно изложение. Има възможност за покупка на гараж срещу допълнителна цена. В сградата се предлагат и други апартаменти."
68m²,"жк. Надежда 2, София",True,"110,000",EUR,Обзаведен,7-ми,14,ТЕЦ,,ЕПК,,,,,,,,,,," Ние от Хевън Хоумс Ви представяме двустаен апартамент на повече от прекрасна локация в жк. Надежда 2. Състоящ се от: входно антре, всекидневна, кухненски бокс и трепезария, спалня, баня, тоалетна, мокро помещение, тераса. РЗП: 68 кв.м. АКТ 16. Разположен е на 7-ми етаж. Отоплението е на ТЕЦ. След ремонт. Ако имотът представлява интерес за Вас, моля свържете се с нас на +359 895 307 021 и посочете референтен номер:38468."
45m²,"жк. Надежда 2, София",True,"76,000",EUR,Полуобзаведен,8-ми,8,ТЕЦ,,Панел,,,,,,,,,,,"Революшън Естейт представя едностаен преустроен на двустаен апартамент  в ж.к. Надежда 2. Мястото се отличава с много добра перспектива за отдаване под наем на имота, тъй като е много комуникативно, поради близостта си до метростанция Надежда, бул. Ломско шосе, освен това - супермаркети, аптеки, магазини, детски градини, училища и спирки на общественния транспорт. Ситуиран е на 8-ми жилищен етаж и разполага с площ от 45 кв.м. разгърната в следното разпределение: входно антре, хол, кухня с усвоен балкон, спалня, баня с тоалетна. Към имота има прилежащо мазе - 4 кв.м. Отопление: ТЕЦ. Изложение: Изток. Жилището е за ремонт. Огледи с предварителна уговорка, моля цитирайте референтен номер: 39985.

Стъпки при покупка: Детайлно оглеждане на имота; Преговаряне на условия при необходимост; Индивидуално изготвяне на предварителен договор, спрямо спецификите на сделката; Изповядване при нотариус.

Имате нужда от: Кредитен консултант? - Имаме го! Юрист? - На ваше разположение е! Нотариус? - Очаква Ви! Експерт в недвижимото имущество? Ние сме!

Какво предлагаме? Цялостно обслужване по сделката и осигуряване на всички документи; Преференциални условия при ремонтни дейности, закупуване на техника и обзавеждане; Комуникация с държавни институции; Съвети и насоки."
62m²,"жк. Надежда 2, София",True,"123,470",EUR,Обзаведен,3-ти,7,Електричество,Преди Aкт 14,Тухла,,,,,,,,,,,"Кв.Надежда 2, на 10 минути от метростанция Бели Дунав, в новострояща се сграда, която се предвижда да бъде завършена за 2 години. Сградата е малка, с РЗП 1032м2, дворното място е 353м2, общо са 7 етажа + мансарден. Предвидено е отоплението да е на ток. Застроената площ на Ап.5 е 51.42м2, а с идеалните части е 62м2, ет.3 над партер. Разпределение: антре, дневна с трапезария и кухненски бокс, излаз на тераса, отделно спалня с балкон, баня с тоалетна.Посочената продажна цена е с включено ДДС.Възможност за закупуване на паркоместа."
140m²,"жк. Надежда 2, София",True,"279,440",EUR,Необзаведен,6-ти,7,Електричество,Преди Aкт 14,Тухла,,,,,,,,,,,"Тристаен апартамент тип мезонет на шести и седми етаж на сградата с чиста площ 116,4 квадратни метра. На първо ниво има просторна слънчева дневна със самостоятелна тераса, кухненската зона предлага излаз на друга просторна тераса, която без много усилия и с мъничко въображение се превръща в собствено дворче като на село, има и тоалетна. На второ ниво са обособени две спални, едната с обширна тераса и баня с тоалетна. Има възможност за гъвкава схема за заплащане на цената до завършване на сградата в края на 2022 година.
Намира се на тиха улица в обновяващ се район, в близост до обществен транспорт, на 700 метра от метростанция 'Надежда', на 700 метра от Северен парк, множество магазини, детски градини, училища, поликлиники, банкови клонове и други.
Бутикова сграда от затворен тип и обособен вътрешен двор. Много светлина през френски прозорци. Изящна фасада с метални орнаменти, висококачествено изпълнение на общите части.

Имот в отдавна урбанизиран район, в малка сграда само с десет жилища. Тишина и спокойствие. Опция за закупуване на паркоместа във вътрешния двор."
168m²,"жк. Надежда 2, София",True,"247,310",EUR,Необзаведен,6-ти,7,Електричество,Преди Aкт 14,Тухла,,,,,,,,,,,"Тристаен апартамент тип мезонет на шести и седми етаж на сградата с чиста площ 145,3 квадратни метра. На първо ниво се влиза директно в просторна слънчева дневна със самостоятелна терса, кухненска зона с излаз на друга просторна тераса, тоалетна. На второ ниво са обособени две спални, две тераси и баня с тоалетна. Над всички, на трето ниво, на над 40 квадратни метра има обширна тераса, която без много усилия и с мъничко въображение се превръща в собствено дворче като на село. Има възможност за гъвкава схема на заплащане на цената до завършване на сградата в края на 2022 година.
Намира се на тиха улица в обновяващ се район, в близост до обществен транспорт, на 700 метра от метростанция 'Надежда', на 700 метра от Северен парк, множество магазини, детски градини, училища, поликлиники, банкови клонове и други.
Бутикова сграда от затворен тип и обособен вътрешен двор. Много светлина през френски прозорци. Изящна фасада с метални орнаменти, висококачествено изпълнение на общите части.

Имот в отдавна урбанизиран район, в малка сграда само с десет жилища. Тишина и спокойствие. Опция за закупуване на паркоместа във вътрешния двор."
71m²,"жк. Надежда 2, София",True,"147,320",EUR,Необзаведен,1-ви,7,Електричество,Преди Aкт 14,Тухла,,,,,,,,,,,"Ателие със застроена площ 61,4 квадратни метра, състоящо се от: антре, две просторни помещения и санитарен възел. Има възможност за гъвкава схема за заплащане на цената до завършване на сградата в края на 2022 година.
Намира се на тиха улица в обновяващ се район, в близост до обществен транспорт, на 700 метра от метростанция 'Надежда', на 700 метра от Северен парк, множество магазини, детски градини, училища, поликлиники, банкови клонове и други.
Бутикова сграда от затворен тип и обособен вътрешен двор. Много светлина през френски прозорци. Изящна фасада с метални орнаменти, висококачествено изпълнение на общите части.

Имот в отдавна урбанизиран район, в малка сграда само с десет жилища. Тишина и спокойствие. Опция за закупуване на паркоместа във вътрешния двор."
50m²,"жк. Надежда 2, София",True,"84,000",EUR,Полуобзаведен,5-ти,9,ТЕЦ,,Панел,,,,,,,,,,,"СРЕДЕН, ЮЖЕН! Застроената площ е 48 м.кв. по Нот. Акт. (без балкона) -реални + 2кв. м. избено помещение, което не влиза в квадратурата на апартамента. Разположение: Коридор , баня с тоалетна, хол с кухня и спалня. Терасата е усвоена и е приобщена към хола с кухнята, ПВЦ дограма, теракот навсякъде, входна врата метална + решетка преди нея, външна топлоизолация, климатик в хола. Топла вода от ТЕЦ + бойлер само за банята (при профилактика). Парното е спряно и радиаторите за свалени! Сменена дограма на входа."
