Размер,Адрес,Точен адрес,Цена,Валута,Обзавеждане,Етаж,Етажи,Отопление,Състояние,Строителство,Спални,Бани,Двор,Площ на парцела,В регулация,Предназначение,Виза,Разрешение за строеж,Категория,Тип,Oписание
60m²,"жк. Надежда 2, София",True,"79,000",EUR,Обзаведен,4-ти,4,ТЕЦ,,Панел,,,,,,,,,,,"К - КОНСУЛТ продава светъл двустаен апартамент в кв. Надежда 2.
Локацията е комуникативна, в близост до множество спирки на градски транспорт, разнообразни търговски обекти, учебни заведения, ресторанти и много други, с бърз достъп до главби пътни артерии.

Входът е добре поддържан, с контрол на достъп и нова PVC дограма, покривът е след качествен ремонт.
Апартаментът се състои от: Коридор, дневна, кухня, спалня, баня с тоалетна и тераса. 
Изложение юг - север.
Жилището разполага с мазе- 5 кв.м.
Отоплението е решено на ТЕЦ.
Свободно паркиране в района. 
К - КОНСУЛТ предлага ремонтни дейности и дизайн, съобразен с вкуса и предпочитанията на всеки клиент."
67m²,"жк. Надежда 2, София",True,"84,000",EUR,Необзаведен,3-ти,6,Прокарва се,Преди Aкт 14,Тухла,,,,,,,,,,,"К - КОНСУЛТ продава двустаен апартамент в новострояща се бутикова сграда с пусков срок началото на 2023г. в кв. Надежда 2.
Сградата е разположена в комуникативен район, на метри от метростанция Надежда, Храм Църква Св. Дух, търговски обекти, ресторанти, банки, куриерски офиси, VIII ДКЦ, училища и детски градини, на пешеходно разстояние от Северен парк.
Сградата се изпълнява без компромис по отношение на качеството при строителство и допълнителните детайли, осигуряващи нужния комфорт на бъдещите собственици.
Използват се най-висок клас съвременни материали и технологии за фасадата и общите части.
Апартаментът се състои от: Входно антре, дневна с кухненски бокс, спалня, баня с тоалетна и тераса.
Има възможност за закупуване на подземни гараж или паркомясто с автоматично задвижване и дистанционно управление.
В сградата има още актуални двустайни и тристайни апартаменти, с избор на изложение и квадратура.

К - КОНСУЛТ предлага висококачествени довършителни работи и дизайн, съобразени с индивидуалните вкус и предпочитания на всеки клиент."
69m²,"жк. Надежда 2, София",True,"91,000",EUR,Необзаведен,2-ри,6,Прокарва се,Преди Aкт 14,Тухла,,,,,,,,,,,"К - КОНСУЛТ продава двустаен апартамент в новострояща се бутикова сграда с пусков срок началото на 2023г. в кв. Надежда 2.
Сградата е разположена в комуникативен район, на метри от метростанция Надежда, Храм Църква Св. Дух, търговски обекти, ресторанти, банки, куриерски офиси, VIII ДКЦ, училища и детски градини, на пешеходно разстояние от Северен парк.
Сградата се изпълнява без компромис по отношение на качеството при строителство и допълнителните детайли, осигуряващи нужния комфорт на бъдещите собственици.
Използват се най-висок клас съвременни материали и технологии за фасадата и общите части.
Апартаментът се състои от: Входно антре, дневна с кухненски бокс, спалня, баня с тоалетна, мокро помещение и тераса.
Има възможност за закупуване на подземни гараж или паркомясто с автоматично задвижване и дистанционно управление.
В сградата има още актуални двустайни и тристайни апартаменти, с избор на изложение и квадратура.

К - КОНСУЛТ предлага висококачествени довършителни работи и дизайн, съобразени с индивидуалните вкус и предпочитания на всеки клиент."
66m²,"жк. Надежда 2, София",True,"94,686",EUR,Необзаведен,2-ри,6,Електричество,,Тухла,,,,,,,,,,,"Place2live предлага на Вашето внимание двустаен апартамент в бутикова, жилищна сграда, разположена на удобно, комуникативно и тихо място в ж.к. Надежда 2. Отлична възможност за живеене или инвестиция в бързо развиващ се район в столицата. В непосредствена близост до метростанция Надежда, хранителни вериги и магазини, ресторанти, банки, офиси на Еконт, Speedy, Easy Pay, община р-н Надежда, VII-мо ДКЦ, множество училища и детски градини, на пешеходно разстояние от метростанция Надежда. За реализацията на проекта е предвидено използването на най-висок клас съвременни материали и технологии, които да допринесат за постигането на запомняща се визия на обекта и високи показатели на енергоспестяване. Апартаментът, който Ви предлагаме е позициониран на 2-ри жилищен етаж. Площта му е 66,70 кв.м. и има следното разпределение: входно антре, всекидневна с кухненски бокс, спалня, баня с тоалетна и тераса. Изложение на имота е юг/запад. Към имота има възможност за закупуване на надземни, подземни паркоместа, гаражи и мазета. В сградата се предлагат още двустайни и тристайни апартаменти с различна квадратура и цена. Имотът ще се издава на шпакловка и замазка. 
За повече информация и огледи, този номер ще Ви е необходим: 1810
PLACE2LIVE предлага професионално съдействие при: 
- Съдействие за одобрение на жилищен и потребителски кредит;
- Всички видове застраховки; 
- Юридически и счетоводни услуги; 
- Строително - Ремонтни дейности до ключ; 
- Обзавеждане.
"
55m²,"жк. Надежда 2, София",True,"73,348",EUR,Необзаведен,2-ри,6,Електричество,В строеж,Тухла,,,,,,,,,,,"Place2live предлага на Вашето внимание двустаен апартамент във бутикова, жилищна сграда, разположена на удобно, комуникативно и тихо място в ж.к. Надежда 2. Отлична възможност за живеене или инвестиция в бързо развиващ се район в столицата. В непосредствена близост до метростанция Надежда , Храм Църква Св. Дух , хранителни вериги и магазини, ресторанти, банки, офиси на Еконт, Speedy, Easy Pay, Община р-н Надежда, VIII ДКЦ, множество училища и детски градини, на пешеходно разстояние от метростанция Надежда. За реализацията на проекта е предвидено използването на най-висок клас съвременни материали и технологии, които да допринесат за постигането на запомняща се визия на обекта и високи показатели на енергоспестяване. Апартаментът, който Ви предлагаме е позициониран на 2-ри жилищен етаж. Площта му е 55,59 кв.м. и има следното разпределение: входно антре, всекидневна с кухненски бокс, спалня, баня с тоалетна и тераса. Изложение юг/запад. Към имота има прилежащо мазе. Възможност за закупуване на надземни, подземни паркоместа и гаражи на цени от 8500 € до 17 000 €. В сградата се предлагат още двустайни и тристайни апартаменти с различна квадратура и цена. За повече информация и огледи, този номер ще Ви е необходим – 1279781. Place2live предлага професионално съдействие при: - Съдействие за одобрение на жилищен и потребителски кредит - Всички видове застраховки - Юридически и счетоводни услуги - Строително - ремонтни дейности до ключ - Обзавеждане."
94m²,"жк. Надежда 2, София",False,"195,000",EUR,,1-ви,,,,Панел,,,,,,,,,,,"Агенция Явлена продава тристаен обзаведен апартамент на 5 минути от метростанция Надежда и Ломско шосе.Апартаментът е вътрешен,топъл и след основен тотален ремонт,включително Ел и ВиК инсталации.Продава се с цялото налично обзавеждане и оборудване, което също е ново и гаранционно.
Имотът е със следното разпределение: коридор с голяма ниша за вграден гардероб,дневна с усвоен балкон, основна спалня с балкон,детска стая с балкон,кухня и баня с тоалетна.Отопление ТЕЦ/климатици във всяка стая.Сградата е с асансьор,към имота има прилежащo мазе.
В непосредствена близост се намират две детски градини,училище,магазини и детски площадки.Големи паркинги за свободно паркиране.Агенцията съдейства за ипотечни кредити.За повече информация и оглед мoжете да се свържете с Мариян Георгиев."
105m²,"жк. Надежда 2, София",False,"150,080",EUR,,2-ри,6,Прокарва се,,Тухла,,,,,,,,,,,"Тристаен апартамент. Състои се от: просторна дневна с тераса, две спални, едната с тераса, всяка със самостоятелна баня и тоалетна. В антрето има кът предвиден за гардероб.

Изгодни цени само за ограничено време!
 Обади се сега и цитирай този код 529545"
76m²,"жк. Надежда 2, София",False,"102,700",EUR,,6-ти,6,Прокарва се,,Тухла,,,,,,,,,,,"Тристаен апартамент. Състои се от:  спалня, баня с тоалетна, втора спалня, дневна с кухня и южна тераса.
 Обади се сега и цитирай този код 529577"
66m²,"жк. Надежда 2, София",False,"94,690",EUR,,2-ри,6,Прокарва се,,Тухла,,,,,,,,,,,"Двустаен апартамент. Състои се от: дневна, с кухня и трапезария, тераса, спалня и баня с тоалетна. Изложението е юг и изток.
 Обади се сега и цитирай този код 529497"
13m²,"жк. Надежда 2, София",False,"16,000",EUR,,,6,Прокарва се,,Тухла,,,,,,,,,,,"Подземно паркомясто в близост до рампата. Квадратурата с общите части е 32.70 кв.м.
 Обади се сега и цитирай този код 529587"
68m²,"жк. Надежда 2, София",False,"98,080",EUR,,2-ри,6,Прокарва се,,Тухла,,,,,,,,,,,"Двустаен апартамент. Изложението е изцяло южно. Състои се от: дневна, с кухня и трапезария, тераса, спалня и баня с тоалетна.
 Обади се сега и цитирай този код 529499"
17m²,"жк. Надежда 2, София",False,"22,000",EUR,,,6,Прокарва се,,Тухла,,,,,,,,,,,"Подземен гараж в близост до рампата. Квадратурата с общите части е 47 кв.м.
 Обади се сега и цитирай този код 529586"
19m²,"жк. Надежда 2, София",False,"27,000",EUR,,,6,Прокарва се,,Тухла,,,,,,,,,,,"Подземно паркомясто в близост до рампата.  Квадратурата с общите части е 32.70 кв.м.
 Обади се сега и цитирай този код 529590"
64m²,"жк. Надежда 2, София",False,"91,540",EUR,,3-ти,6,Прокарва се,,Тухла,,,,,,,,,,,"Двустаен апартамент. Състои се от: спалня, баня с тоалетна, дневна с кухня и трапезария и тераса. Изложението е юг и изток.
 Обади се сега и цитирай този код 529501"
56m²,"жк. Надежда 2, София",False,"79,050",EUR,,4-ти,6,Прокарва се,,Тухла,,,,,,,,,,,"Двустаен апартамент. Състои се от: дневната с кухня и тераса, хол с преход към спалня и баня с тоалетна.
 Обади се сега и цитирай този код 529556"
91m²,"жк. Надежда 2, София",False,"129,890",EUR,,6-ти,6,Прокарва се,,Тухла,,,,,,,,,,,"Тристаен апартамент. Състои се от: две самостоятелни спални, баня с тоалетна и дневна с кухненски бокс. Жилището разполага с тераса, към дневната.
 Обади се сега и цитирай този код 529580"
120m²,"жк. Надежда 2, София",False,"248,999",EUR,Необзаведен,3-ти,5,Локално отопление,,Тухла,,,,,,,,,,,"Предлагам за продажба четиристаен непреходен тухлен апартамент с АКТ 16 от 2021 год. Разпределението е три самостоятелни спални, дневна с трапезария и кухненски бокс, две тераси, баня с тоалетна , самостоятелна тоалетна, мазе. Апартамента е ремонтиран с изложение изток/запад. Сграда с 12 апартамента, луксозно изпълнение. Огромен и просторен апартамент находящ се на 50 метра от метростанция Надежда. На втора линия и не е шумно, улицата е тиха и спокойна.
"
85m²,"жк. Надежда 2, София",False,"135,000",EUR,Обзаведен,3-ти,8,ТЕЦ,,Панел,,,,,,,,,,,"Номер в агенцията 47794. 
Предлагаме тристаен апартамент в ж.к. Надежда 2. Намира се на 5 мин. пеша от метростанция Хан Кубрат и Надежда, същевремно е на тиха и спкойна улица. Апартаментът е голям, тристаен, вътрешен с голяма кухня, хола има преход към двете спални, с два балкона, баня и отделно тоалетна, сервизно помещение. Частично ремонтиран. Продава се с обзавеждането. Изложение - СИ/ЮЗ. 
Огледи с уговорка.
"
106m²,"жк. Надежда 2, София",False,"150,080",EUR,Необзаведен,2-ри,6,Електричество,,Тухла,,,,,,,,,,,"Place2live предлага на Вашето внимание тристаен апартамент в бутикова, жилищна сграда, разположена на удобно, комуникативно и тихо място в ж.к. Надежда 2. Отлична възможност за живеене или инвестиция в бързо развиващ се район в столицата. Жилището е в непосредствена близост до метростанция Надежда, храм църква Св. Дух, големи хранителни вериги и магазини, ресторанти, банки, офиси на Еконт, Speedy, Easy Pay, община р-н Надежда, VIII-мо ДКЦ, множество училища и детски градини, на пешеходно разстояние от метростанция Надежда. За реализацията на проекта е предвидено използването на най-висок клас съвременни материали и технологии, които да допринесат за постигането на запомняща се визия на обекта и високи показатели на енергоспестяване. Апартаментът, който Ви предлагаме е позициониран на 2-ри жилищен етаж. Площта му е 105.69 кв.м. и има следното разпределение: входно антре, всекидневна с кухненски бокс, две спални, две бани с тоалетни и две тераси. Апартаментът е с изложение юг/запад. Има възможност за закупуване на надземни и подземни паркоместа, гаражи и мазета. В сградата се предлагат още двустайни и тристайни апартаменти с различна квадратура и цена.
За повече информация и огледи, този номер ще Ви е необходим: 1807
PLACE2LIVE предлага професионално съдействие при: 
- Съдействие за одобрение на жилищен и потребителски кредит;
- Всички видове застраховки; 
- Юридически и счетоводни услуги; 
- Строително - Ремонтни дейности до ключ; 
- Обзавеждане.
"
158m²,"жк. Надежда 2, София",False,"255,000",EUR,,1-ви,,,,Тухла,,,,,,,,,,,"Оферта: ***14508*** КОРТА ИМОТИ предлага нов, просторен и светъл многостаен апартамент в най-хубавата част на кв. Надежда 2. Имота се намира на изключително комуникативно място в близост до спирки на градски транспорт, магазини, аптеки, училища, детски градини и др.

***РАЗПРЕДЕЛЕНИЕ*** 
Състои се от:
 Първо ниво - дневна с кът за хранене, кухненски бокс, мокро помещение, тоалетна и голяма тераса с югоизточно изложение.
Второ ниво - три спални и балкон, баня с тоалетна.
Трето ниво - студио с баня, тоалетна и балкон.

***АКЦЕНТИ***
  *Ремонтиран;
 * Поддържани общи части.

***ДОПЪЛНИТЕЛНА ИНФОРМАЦИЯ***
- Тухла;
- Отопление на климатици;
- Комуникативно място.
-Прилежащо мазе;

За нови предложения и подобни оферти, посетете нашия сайт www.cortaimoti.com или се обадете на *** Тел. 0887 000 452 ***
Очакваме Ви на посочения телефон, за да Ви дадем подробна информация относно предлагания имот. Ние сме реномирана компания, което ни задължава да Ви предоставим допълнителни услуги и следпродажбено обслужване. Професионалистите от КОРТА ИМОТИ ще бъдат с Вас през целия процес по покупко-продажба на имота. Допълнитетелните услуги, които предлага екипът ни включва проучване и предлагане на най-добрите оферти на банкови институции за получаване на одобрение за Ипотечен и/или Потребителски кредит, юридически и нотариални услуги, застраховки и др. Ние се стремим да влагаме качество и индивидуален подход във всичко, което правим и да предлагаме на нашите клиенти само най-доброто качество и обслужване.  
"
