Размер,Адрес,Точен адрес,Цена,Валута,Обзавеждане,Етаж,Етажи,Отопление,Състояние,Строителство,Спални,Бани,Двор,Площ на парцела,В регулация,Предназначение,Виза,Разрешение за строеж,Категория,Тип,Oписание
54m²,"жк. Захарна Фабрика, София",False,"76,500",EUR,Обзаведен,1-ви,8,ТЕЦ,,Тухла,,,,,,,,,,,"Номер в агенцията 48179. 
Предлагаме двустаен апартамент в Захарна фабрика. Жилището е с изцяло с източно изложение и се състои от две стаи, кухня с остъклен балкон и баня с тоалетна. Дограмата на двете стаи е сменена. Подготвен е за ремонт. Намира се в тих район, в близост до детска градина и училище. 
Огледи с уговорка.
"
70m²,"жк. Захарна Фабрика, София",True,"125,000",EUR,Необзаведен,2-ри,4,Електричество,,Панел,,,,,,,,,,,"АЯКС Ви представя тристаен апартамент в кв.Захарна фабрика. Ситуиран е на 2ри жилищен етаж и разполага с площ от 70кв.м.
Разпределение:вх.антере, хол с кухненски бокс, две спални помещения, баня с тоалетна и тераса.

Покупката на жилище е изключително важен момент от живота на всеки човек и за това искаме да предложим най- доброто. Услугите, които можем да предложим, включват:
Получаване на одобрение за ипотечен кредит.
Застраховка на движимо и недвижимо имущество.
Строителни ,ремонтни дейности и изготвяне на 3-д интериорен дизайн , за да си представите как би изглеждал вашия мечтан дом
Юридически и счетоводни услуги и др.

За удобство на клиента, екипът ни е договорил с нашите финансови партньори преференциални условия за банков кредит.

При интерес към този или друг имот се свържете с нас за повече информация, безплатна консултация или уговорка за оглед.

Референтен номер:128944"
135m²,"жк. Захарна Фабрика, София",True,"170,000",EUR,Обзаведен,4-ти,6,Локално отопление,,Тухла,,,,,,,,,,," Предлагаме Ви просторен, светъл, непреходен апартамент в непосредствена близост до входа на Западен парк и транспортни линии. Сградата е с разрешение за ползване /Акт 16/ от 2007 год. Жилището се състои от: широко антре, дневна с трапезария и кухнеснки бокс с тераса, две спални с голяма обща тераса, баня с тоалетна, мокро помещение или втора тоалетна, мазе - 1 кв.м. Застроена площ на апартамента 115.75 кв.м. Изложения: североизток за спални и югозапад за дневната. Възможност за покупка на подземен гараж с площ от 20 кв.м. Съдействие за ипотечен кредит, предварително одобрение в рамките на два дни, рефинансиране!! Доверете се на нашия дългогодишен опит, АГЕНЦИЯ 'ВИТОША ЕСТЕЙТ' - основана 2006г. За още подобни, ПОДБРАНИ и ПРОВЕРЕНИ оферти само на www.vitoshaestate.com ОФЕРТА: 636"
71m²,"жк. Захарна Фабрика, София",True,"145,000",EUR,Обзаведен,4-ти,16,Електричество,,ЕПК,,,,,,,,,,,"АЯКС Ви представя страхотен тристаен апартамент в кв. Захарна фабрика. Ситуиран е на 4ти жилищен етаж и разполага с площ от 71кв.м.
Разпределение: вх.антре, кухня, хол, спалня, баня с тоалетна и три тераси.

Покупката на жилище е изключително важен момент от живота на всеки човек и за това искаме да предложим най- доброто. Услугите, които можем да предложим, включват:
Получаване на одобрение за ипотечен кредит.
Застраховка на движимо и недвижимо имущество.
Строителни ,ремонтни дейности и изготвяне на 3-д интериорен дизайн , за да си представите как би изглеждал вашия мечтан дом
Юридически и счетоводни услуги и др.

За удобство на клиента, екипът ни е договорил с нашите финансови партньори преференциални условия за банков кредит.

При интерес към този или друг имот се свържете с нас за повече информация, безплатна консултация или уговорка за оглед.

Референтен номер:195754"
88m²,"жк. Захарна Фабрика, София",False,"135,000",EUR,Обзаведен,3-ти,6,ТЕЦ,,Тухла,,,,,,,,,,,"Имоти Премиер представя тристаен апартамент нaxoдящ ce на трети етаж мacивнo мoнoлитнa тyxлeнa cгpaдa в жк Захарна Фабрика. Разполага с площ c 114кв.м. С дoбpe пoддъpжaни oбщи чacти, ĸoнтpoлиpaн дocтъп и opгaнизиpaнa eтaжнa coбcтвeнocт.

PAЗΠPEДEЛEHИE: Bxoднo пpeддвepиe, ĸyxня c пpилeжaщa тepaca, ycвoeнa ĸъм нeя; двe cпaлни, eднaтa oт ĸoитo e пpexoднa oт пpocтopнa днeвнa, c пpилeжaщa тepaca ĸъм днeвнaтa и cпaлнятa; бaня, oтдeлнo тoaлeтнa и гapдepoбнa. Kъм имoтa имa и мaзe.

ЛOKAЦИЯ: жĸ Зaxapнa Фaбpиĸa. B нeпocpeдcтвeнa близocт дo пapĸ / Зaпaдeн пapĸ/ , дeтcĸи гpaдини и yчилищa. B близocт дo зaвeдeния зa xpaнeнe, cпиpĸи нa гpaдcĸи тpaнcпopт, дeтcĸи плoщaдĸи и paзнooбpaзни тъpгoвcĸи oбeĸти. Изĸлючитeлнo дoбpe paзвитa coциaлнa инфpacтpyĸтypa. Πapĸиpaнeтo e cвoбoднo!

Код на обявата: 329658"
100m²,"жк. Захарна Фабрика, София",False,"114,999",EUR,,1-ви,8,,,Панел,,,,,,,,,,,"АRCO REAL ESTATE ПРОДАВА ЕКСКЛУЗИВНО тристаен апартамент ситуиран на 1-ви етаж в жилищна сграда - панел, в близост до ул. Кукуш, недалеч от входа на Западен парк. 
Пред сградата има обособен паркинг за живущите, а от южната страна прекрасен парк  и детска площадка.
Впечетляващо  тихо и  спокойно място, с много зеленина. В района има детска градина, магазини и др.
Локацията осигурява удобен градски транспорт, бърз достъп до бул. Сливница, центъра на столицата и главни пътни артерии.

Слънчев,  просторен и топъл, апартаментът  е със следното разпределение: входно антре с Т-образен коридор, просторна всекидневна(хол), самостоятелна спалня с излаз на балкон - общ с всекидневната, втора спалня, кухня с излаз на балкон, баня, тоалетна, килер. Към жилището има и прилежащо мазе. Изложение _ Север/Юг. Отопление - ТЕЦ. 
За ваше улеснение ви предоставяме схема разпределение.
Състояние: За оснвен съвременен ремонт. Сменена дограма - ПВЦ. Саниран.
Вход с контролиран достъп и добре поддържани общи части.


Имот с потенциал да се преустрои на четиристаен апартамент.  Състоянието му е предоставя възможност на бъдещите  собственици да  реализират своите желания, идеи и  интериорни решения - за да сътворят своят дом мечта, да го изпълнят с любов, хармония и топлота. 

За повече информация и оглед се обадете на посоченият телефон. Агенцията работи по изискванията на БДС EN 15733.
Предлагаме съдействие за ипотечно кредитиране и изготвяне на пазарна оценка на имота.
Контакти - Дора Недина Телефон за връзка: 0895770242, Вайбър: 0896 733 915
Имейл dora.nedina@arcoreal.bg





Оферта №79580"
54m²,"жк. Захарна Фабрика, София",False,"76,500",EUR,Необзаведен,1-ви,,ТЕЦ,,Тухла,,,,,,,,,,,"Оф. 24372. Апартаментът е изцяло с източно изложение и се състои от две стаи, кухня с остъклен балкон и сервизно помещение (баня с тоалетна). Дограмата на двете стаи е сменена. Подготвен е за ремонт. Продава се заедно с мазе 7 кв.м.
Намира се в тих район, в близост има детска градина и училище.
"
40m²,"жк. Захарна Фабрика, София",False,"72,000",EUR,Необзаведен,6-ти,,,,Тухла,,,,,,,,,,, Оф. 24353. Светъл и топъл  апартамент след ремонт. Жилището има малък балкон. Блока е саниран. Панел от 1976г.  с асансьор. 
