Размер,Адрес,Точен адрес,Цена,Валута,Обзавеждане,Етаж,Етажи,Отопление,Състояние,Строителство,Спални,Бани,Двор,Площ на парцела,В регулация,Предназначение,Виза,Разрешение за строеж,Категория,Тип,Oписание
46m²,"жк. Надежда 2, София",False,"70,000",EUR,Необзаведен,4-ти,8,ТЕЦ,,Панел,,,,,,,,,,,"Гарсониера с източно изложение в кв.Надежда-2!  Подходящ за преустройство в двустаен! Апартаментът е на среден етаж и е разпределен както следва: коридор, хол, кухня, баня с тоалетна и тераса. Имотът е за ремонт!
 Обади се сега и цитирай този код 563277"
76m²,"жк. Надежда 2, София",False,"160,000",EUR,Обзаведен,4-ти,,Локално отопление,,Тухла,,,,,,,,,,,"Имоти Комфорт, Ви представя супер луксозно обзаведен апартамент, в Надежда 2. Жилището е със следното разпределение: хол с трапезария и кухня, спалня с гардеробна, втора спалня, широк коридор, баня и тоалетна. В непосредствена близост има метростанция, удобен градски транспорт, детски градини, училища, хранителни магазини. Пред блока може да се паркира спокойно."
56m²,"жк. Надежда 2, София",False,"92,000",EUR,Необзаведен,6-ти,6,Електричество,,Тухла,,,,,,,,,,,"Продавам двустаен апартамент, който е open spase и може да се изгради стена  ида станат две нормални стаи, баня с тоалетна и две тераси. Има паркоместа на цена от 8000 евро и гаражи на 30000 евра. Изложението е юг, слънчев и светъл дом. Гледка към Витоша и цяла София. Намира се в близост до транспорт и на 5 минути между две метростанции. Завършен до ключ, готов за нанасяне. 
"
87m²,"жк. Надежда 2, София",False,"135,000",EUR,Обзаведен,1-ви,8,ТЕЦ,,Панел,,,,,,,,,,,"Предлагаме просторен тристаен апартамент в Надежда 2. Апартаментът се състои от кухня, дневна, две спални, баня с тоалетна, отделна тоалетна, килер и тераса. Жилището е много добро състояние, сменена е дограмата без в една стая, сменени радиатори, има допълнителна външна изолация на целия апартамент. Изцяло вътрешен е, което го прави топъл. Изложението на апартамента е изток и запад. Дневната и едната спалня са на изток, кухнята и другата спалня са на запад. Отоплението е на ТЕЦ. Продава се без обзавеждането в едната спалня, за другата част от обзавеждането ще се договори допълнително. Намира се на комуникативно място в близост до училище, детска градина, спирка на градски транспорт. Агенцията разполага с ключ и огледи са възможни в удобно за вас време.
"
61m²,"жк. Надежда 2, София",False,"72,581",EUR,,1-ви,7,ТЕЦ,,Тухла,,,,,,,,,,,"Двустаен апартамент със застроена площ от 50 кв.м. и 61.81кв.м. с общите части. Състои се от: антре, дневна с кухненски бокс, спалня, баня с тоалетна и тераса. Изложението е югозападно. Към апартамента има склад в сутерена. Предлага се и паркомясто, което се заплаща допълнително. Жилището се предава на фина шпакловка и замазка, хоризонтална и вертикална инсталация до тапа и монтирана входна врата. Отоплението и топлата вода са на ТЕЦ. Резервация на жилището може да се направи с депозит в размер на 2500 евро.
 Обади се сега и цитирай този код 556986"
205m²,"жк. Надежда 2, София",True,,,Обзаведен,4-ти,5,ТЕЦ,,Тухла,,,,,,,,,,,"ПРОСТОРЕН, СЛЪНЧЕВ МЕЗОНЕТ. ОТЛИЧНА ЛОКАЦИЯ! БЛИЗО ДО „ФАНТАСТИКО” и  МЕТРОСТАНЦИЯ „НАДЕЖДА”. Сграда от 2009г. , без асансьор. С ПОДЗЕМЕН ГАРАЖ -40кв.м. В ЦЕНАТА! Състои се от: Първо ниво- коридор, килер, баня с тоалетна, кухненски бокс, дневна, тераса; Второ ниво- спалня, баня с тоалетна, тераса 80 м с възможност за усвояване. Изложение :изток/ запад. За контакти: 0888720101

"
105m²,"жк. Надежда 2, София",True,"128,500",EUR,Обзаведен,13-ти,16,ТЕЦ,,ЕПК,,,,,,,,,,,"Компания `ЕКС` представя на Вашето внимание тристаен апартамент на метри от метростанция в жк Надежда. Апартаментът разполага с чиста жилищна площ от 105 кв.м. разпределени във входно антре, дневна, кухня, две спални, баня с тоалетна, отделна тоалетна, една усвоена и две неусвоени тераси. Апартаментът е с поставена топлоизолация, PVC дограма и се намира в блок с подържани общи части и контрол на достъпа. Заповядайте да Ви го покажем. Използвайки нашите услуги Вие ще превърнете закупуването на новия си дом в едно приятно изживяване, ще получите персонален консултант, съдействие при кандидатстване за кредит, професионален декоратор и екип, който да се погрижи за нужните документи по Вашата сделка. Възползвайте се от безплатна консултация в наш офис, където ще ви спестим време и ще ви запознаем с всички актуални имоти в България, отговарящи на Вашето търсене. На Ваше разположение сме всеки ден, от понеделник до неделя от 09:00 до 20:00ч. Нужен Ви е само кодът към имота: 32437."
115m²,"жк. Надежда 2, София",True,"279,000",EUR,Обзаведен,2-ри,7,ТЕЦ,,Тухла,,,,,,,,,,,"Агенция за недвижими имоти ""Дрийм селект"" ви представя луксозно обзаведен тристаен апартамент в ж.к. Надежда 2. С бърз достъп до бул. ""Ломско шосе"" и ул. ""Христо Силянов"", в близост до метростанция и спирки на градски транспорт, хранителни магазини, детски градини, училище.

Жилището се състои от входно антре, просторна дневна с кухненски бокс, две спални, две бани, тераса
Към имота има мазе.
Отоплението е на ТЕЦ, има монтиран и климатик.

Има възможност за закупуване на гараж в сградата.

Агенцията предлага безплатно професионално съдействие за банково кредитиране.

За повече информация, огледи и още актуални предложения се свържете с нас на посочения номер.
Водещ брокер: Кристин Йорданова"
75m²,"жк. Надежда 2, София",True,"125,400",EUR,Необзаведен,6-ти,6,ТЕЦ,,Панел,,,,,,,,,,,"Революшън Естейт Ви представя просторен и слънчев двустаен, преустроен на тристаен апартамент  в ж.к. Надежда 2, намиращ се в добре поддържан панелен блок от 1970 г. Имотът е разположен на 6-ти жилищен етаж и разполага с площ от 75 кв.м. разгърната в следното функционално разпределение: входно антре, всекидневна с кухненски бокс, спалня, детска стая, баня с тоалетна, две тераси, като едната е усвоена, а другата е остъклена. Отоплението се осъществява посредством топлофикация. Жилището е много топло, вътрешно и с изцяло южно изложение. Имотът е след основен ремонт, със сменени ел. и вик инсталации, щрангове, дограма, стенна и подова изолация, осветление и настилки. Покривът е изцяло ремонтиран. Над апартамента има 1.20 м. подпокривно топлоизолационно въздушно пространство. Мястото се отличава с много добра перспектива за отдаване под наем на имота, тъй като е много комуникативно, поради близостта си до метростанция Хан Кубрат, супермаркет 'Била', аптеки, магазини, детски градини, училища и спирки на общественния транспорт. Основните пътни артерии са бул. Ломско шосе и бул. Рожен, посредством които се осъществява връзка с други квартали на града. Перфектен имот както за инвестиция, така и за лично ползване. Огледи с предварителна уговорка, моля цитирайте референтен номер: 39962.

Стъпки при покупка: Детайлно оглеждане на имота; Преговаряне на условия при необходимост; Индивидуално изготвяне на предварителен договор, спрямо спецификите на сделката; Изповядване при нотариус.

Имате нужда от: Кредитен консултант? - Имаме го! Юрист? - На ваше разположение е! Нотариус? - Очаква Ви! Експерт в недвижимото имущество? Ние сме!

Какво предлагаме? Цялостно обслужване по сделката и осигуряване на всички документи; Преференциални условия при ремонтни дейности, закупуване на техника и обзавеждане; Комуникация с държавни институции; Съвети и насоки."
63m²,"жк. Надежда 2, София",False,"98,800",EUR,,4-ти,6,ТЕЦ,,Тухла,,,,,,,,,,,"Двустаен апартамент, състои се от:  дневна с кухня и трапезария,спалня, баня с тоалетна.Жилището се предава на  мазилка и замазка с монтирана блиндирана входна врата.
 Обади се сега и цитирай този код 565775"
62m²,"жк. Надежда 2, София",True,"92,805",EUR,Обзаведен,1-ви,9,ТЕЦ,След Акт 14,Тухла,,,,,,,,,,," Титан Пропъртис представя на Вашето внимание двустаен апартамент находящ се в новострояща се сграда, с локация ж.к. Надежда 2. Локацията е повече от прекрасна, в непосредствена близост са разположени детски градини, училища, спирки на градски транспорт, търговски обекти, както и зони за отдих и спорт.

 Апартамента е разположен на 1-ви жилищен етаж и разполага със застроена площ 53,52 кв.м., разгърната по следния практичен начин: антре, дневна с трапезария и кухненски бокс, спалня, баня с тоалетна, тераса. Отопление: ТЕЦ. Изложение: изток. Сградата е на етап Акт 14. Имотът се предлага на шпакловка и замазка, за да може Вашето въображение да го превърне в мечтания за Вас нов ДОМ!

 За оглед на това и други атрактивни предложения, не се колебайте да ни потърсите на посочения телефон или да ни изпратите данните си чрез формата за запитване на сайта. Реф. номер: 37481."
104m²,"жк. Надежда 2, София",True,"128,000",EUR,Необзаведен,7-ми,9,ТЕЦ,След Акт 14,Тухла,,,,,,,,,,," Титан Пропъртис представя на Вашето внимание тристаен апартамент, находящ се на повече от прекрасна локация, а именно ж.к. Надежда 2. В непосредствена близост се намират множество търговски обекти, спирки на градски транспорт, детски градини, училища, зони за отдих и спорт, както и метростанция Надежда, която се намира на 940 м. пешеходно разстояние.

 Апартаментът е ситуиран на 7-ми жилищен етаж, в новострояща се сграда и разполага със застроена площ от 89,57 кв.м., разгърната по следния практичен начин: антре, дневна с трапезария и кухненски бокс, 2 спални, дрешник, баня с тоалетна, тераса. Изложение: запад. Отопление: ТЕЦ. Сградата е с издаден Акт 14, Акт 16 до края на 2023г. Имотът се продава на шпакловка и замазка, за да може Вашето въображение да го превърне в мечтания за Вас нов ДОМ!

 За оглед на това и други атрактивни предложения, не се колебайте да ни потърсите на посочения телефон или да ни изпратите данните си чрез формата за запитване на сайта. Реф. номер: 37482."
76m²,"жк. Надежда 2, София",True,"159,900",EUR,Обзаведен,4-ти,5,Електричество,,Тухла,,,,,,,,,,,"ЧУДЕСНО ПРЕДЛОЖЕНИЕ! ТУХЛА ОТ 2019 г., ОБЗАВЕДЕН, ДО МЕТРОСТАНЦИЯ... Намира се на бул. ""Ломско шосе"" в близост до метростанция ""Надежда"". Етаж 4 в 5-етажна тухлена сграда от 2019 г. Има асансьор. Състои се от антре, дневна с кухненски бокс, 2 спални /едната с гардеробна/ и баня с тоал. Южно изложение. Отопление на ток с климатици. Завършен със съвременни настилки и дограми. Продава се ОБЗАВЕДЕН. Добре поддържани общи части с контролиран достъп. Има места за паркиране около блока, както и паркинг в близост. ИМЕЯ. "
63m²,"жк. Надежда 2, София",False,"102,000",EUR,,3-ти,6,,,Тухла,,,,,,,,,,,"Без комисион от купувача! Двустаен тухлен апартамент със застроена площ от 54.89кв.м.(63.69 кв.м. с общ. части). Състои се от:  дневна с кухня и трапезария/22.52кв.м./, една преходна спалня /13.19кв.м./, общ  балкон/4.38кв.м./, склад/0.81кв.м./, баня с тоалетна/3.57кв.м./ Изложение : североизток-северозапад. Жилището се предава на  мазилка и замазка с монтирана блиндирана входна врата.
 Обади се сега и цитирай този код 565774"
68m²,"жк. Надежда 2, София",True,"110,000",EUR,Обзаведен,7-ми,16,ТЕЦ,,ЕПК,,,,,,,,,,,"С НАС Е ПО-ЛЕСНО! Двустаен апартамент в много добро състояние след ремонт на 5 минути от Метростанция НАДЕЖДА. След ремонт със сменена дограма, шпаклован и боядисан, ремонтирана баня и тоалетна. Настилките са ламиниран паркет и мрамор. РАЗПРЕДЕЛЕНИЕ: Дневна с тераса, която е остъклена, спалня; кухня с малка тераса; баня и отделна тоалетна, голям килер и коридор. НОМЕР НА ОФЕРТАТА 106146. За повече информация на посочените телефони. На всички прочели обявата пожелавам слънчев ден."
51m²,"жк. Надежда 2, София",True,"118,000",EUR,Обзаведен,2-ри,7,ТЕЦ,,Тухла,,,,,,,,,,,"Агенция за недвижими имоти ""Дрийм селект"" ви представя луксозно обзаведен двустаен апартамент в ж.к. Надежда 2. С бърз достъп до бул. ""Ломско шосе"" и ул. ""Христо Силянов"", в близост до метростанция и спирки на градски транспорт, хранителни магазини, детски градини, училище.

Жилището се състои от входно антре, дневна с кухненски бокс, спалня, баня с тоалетна. 
Към имота има мазе.
Отоплението е на ТЕЦ, има монтиран и климатик.

Има възможност за закупуване на гараж в сградата.

Агенцията предлага безплатно професионално съдействие за банково кредитиране.

За повече информация, огледи и още актуални предложения се свържете с нас на посочения номер.
Водещ брокер: Кристин Йорданова"
76m²,"жк. Надежда 2, София",True,"165,000",EUR,Обзаведен,4-ти,5,Електричество,,Тухла,,,,,,,,,,,"Тристаен апартамент в кв. Надежда 2, бул. Ломско Шосе. Сградата беше завършена през ноември 2019. Много комуникативно място - на 350 м. метростанция Надежда, близо има Фантастико, Била, банки, денонощна аптека, 8-а поликлиника, детски градини. На 50 метра от бензиностация Шел. Отоплява се с климатици и поради южното изложение, сметките за ток са ниски. Пред блока може да се паркира и кола, също така и от среща има безплатен паркинг (до ресторанта)
Състои се от хол с трапезария и кухня, спалня с гардеробна, коридор с гардеробна, детска стая, баня и тоалетна. Апартамент се продава напълно обзаведен."
65m²,"жк. Надежда 2, София",True,"92,900",EUR,Обзаведен,1-ви,5,ТЕЦ,,Панел,,,,,,,,,,,"Компания 'ЕКС' представя на Вашето внимание двустаен апартамент в сърцето на жк Надежда 2. На метри от две детски градини, училище, хранителен супермаркет и на пешеходно разстояние от метростанция и спирки на градски транспорт. Апартаментът разполага с чиста жилищна площ от 65 кв.м. разпределена във входно антре, дневна, кухня, спалня, баня с тоалетна и 2 тераси. Позволява лесно преустройство в тристаен апартамент . Заповядайте да Ви го покажем. Използвайки нашите услуги Вие ще превърнете закупуването на новия си дом в едно приятно изживяване, ще получите персонален консултант, съдействие при кандидатстване за кредит, професионален декоратор и екип, който да се погрижи за нужните документи по Вашата сделка. На Ваше разположение сме всеки ден, от понеделник до неделя от 09:00 до 20:00ч. Заповядайте на консултация в наш офис, където ще ви спестим време и ще ви запознаем с всички актуални имоти в България, отговарящи на Вашето търсене. Нужен Ви е само кодът към имота: 18944."
