Размер,Адрес,Точен адрес,Цена,Валута,Обзавеждане,Етаж,Етажи,Отопление,Състояние,Строителство,Спални,Бани,Двор,Площ на парцела,В регулация,Предназначение,Виза,Разрешение за строеж,Категория,Тип,Oписание
42m²,"жк. Надежда 2, София",False,"57,672",EUR,,6-ти,6,ТЕЦ,,Тухла,,,,,,,,,,,"Екипът на Йохоум недвижими имоти има удоволствието да ви представи нова сграда в ж.к. Надежда 2. Предлагаме ви двустаен апартамент, който се намира на 6-ти жилищен етаж и се състои от: всекидневна, баня с тоалетна, балкон. Сградата очаква Aкт15 в началото на 2023 година и се състои от ателиета, двустайни и тристайни апартаменти с функционални разпределения. Има възможност за закупуване на подземни и наземни паркоместа и гаражи. В близост се намират спирки на градски транспорт, супермаркети, училища,детска градина, заведения за хранене и търговски обекти. За повече информация и организиране на оглед се свържете с нас и цитирайте кода на обявата: 7943.

Разгледайте останалите атрактивни предложения на страницата ни: www.yohome.bg"
65m²,"жк. Надежда 2, София",False,"88,736",EUR,Необзаведен,5-ти,6,ТЕЦ,,Тухла,,,,,,,,,,,"Екипът на YOHOME недвижими имоти има удоволствието да ви представи двустаен апартамент в ж.к. Надежда 2. Апартаментът се намира на 5-ти жилищен етаж в нова сграда и се състои от: входно антре, всекидневна, спалня, баня с тоалетна, балкон. Сградата е на Акт14 и се състои от ателиета, двустайни и тристайни апартаменти с функционални разпределения. Има възможност за закупуване на подземни и наземни паркоместа и гаражи. В близост се намират спирки на градски транспорт, супермаркети, училища, детска градина, заведения за хранене и търговски обекти. За повече информация и организиране на оглед се свържете с нас и цитирайте кода на обявата: 8983.

Разгледайте останалите атрактивни предложения на страницата ни: www.yohome.bg"
102m²,"жк. Надежда 2, София",False,"137,740",EUR,,3-ти,6,ТЕЦ,,Тухла,,,,,,,,,,,"Екипът на Йохоум недвижими имоти има удоволствието да ви представи нова сграда в ж.к. Надежда 2. Предлагаме ви тристаен апартамент, който се намира на 3-ти жилищен етаж и се състои от: входно антре, всекидневна, две спални, баня с тоалетна, два балкона. Сградата очаква Aкт15 в началото на 2023 година и се състои от ателиета, двустайни и тристайни апартаменти с функционални разпределения. Има възможност за закупуване на подземни и наземни паркоместа и гаражи. В близост се намират спирки на градски транспорт, супермаркети, училища,детска градина, заведения за хранене и търговски обекти. За повече информация и организиране на оглед се свържете с нас и цитирайте кода на обявата: 7942.

Разгледайте останалите атрактивни предложения на страницата ни: www.yohome.bg"
72m²,"жк. Надежда 2, София",False,"98,307",EUR,,1-ви,6,ТЕЦ,,Тухла,,,,,,,,,,,"Екипът на Йохоум недвижими имоти има удоволствието да ви представи нова сграда в ж.к. Надежда 2. Предлагаме ви двустаен апартамент, който се намира на 1-ви жилищен етаж и се състои от: входно антре, всекидневна, спалня, баня с тоалетна, балкон. Сградата очаква Aкт15 в началото на 2023 година и се състои от ателиета, двустайни и тристайни апартаменти с функционални разпределения. Има възможност за закупуване на подземни и наземни паркоместа и гаражи. В близост се намират спирки на градски транспорт, супермаркети, училища,детска градина, заведения за хранене и търговски обекти. За повече информация и организиране на оглед се свържете с нас и цитирайте кода на обявата: 7941.

Разгледайте останалите атрактивни предложения на страницата ни: www.yohome.bg"
73m²,"жк. Надежда 2, София",False,"98,550",EUR,Необзаведен,1-ви,6,Електричество,,Тухла,,,,,,,,,,,"Агенция за недвижими имоти 'Perfe' има удоволствието да Ви представи:

Двустаен апартамент за продажба с локация кв. Надежда 2

Сградата е на етап пред АКТ 15.

Жилището е ситуирано на 1-ви жил. етаж с обща площ от 73 кв.м. ие със следното практично разпределение:
входно антре, дневна, спалня, баня с тоалетна, балкон.

Локацията е комуникативна, същевременно тиха и спокойна в близост до метростанция, спирки на градски транспорт, магазини.

Разполагаме и с друг тип свободни апартаменти в сградата с различна квадратура, на различни етажи.

Възможност за покупка на паркоместа и гаражи, единични и двойни на стойност от 24 000 EUR до 48 000 EUR.



За повече въпроси и записване на час за оглед, обадете се на тел.: +359 896505656.

Референтен номер на имота:25854
"
102m²,"жк. Надежда 2, София",False,"137,700",EUR,Необзаведен,3-ти,6,Електричество,,Тухла,,,,,,,,,,,"Агенция за недвижими имоти 'Perfe' има удоволствието да Ви представи:

Тристаен апартамент за продажба с локация кв. Надежда 2

Сградата е на етап пред АКТ 15.

Жилището е ситуирано на 3-ти  етаж от общо 6, с обща площ от 102 кв.м. и е със следното практично разпределение:

входно антре, дневна, две спални, баня с тоалетна, тераса.

Локацията е комуникативна, същевременно тиха и спокойна в близост до метростанция, спирки на градски транспорт, магазини.

Разполагаме и с друг тип свободни апартаменти в сградата с различна квадратура, на различни етажи.

Възможност за покупка на паркоместа и гаражи, единични и двойни на стойност от 24 000 EUR до 48 000 EUR.

За повече въпроси и записване на час за оглед, обадете се на тел.: +359 896505656.

Референтен номер на имота: 25855
"
45m²,"жк. Надежда 2, София",False,"69,500",EUR,Необзаведен,7-ми,9,ТЕЦ,,Панел,,,,,,,,,,,"КЛИЕНТИТЕ НА MARTIN'S СА ПО-ДОВОЛНИ! ПОПИТАЙ ЗАЩО!
Топ локация на топ цена!
Имота е с депозит до 17.02.2023г.
Предлагаме среден едностаен апартамент, преустроен в двустаен в кв. ""Надежда"" 2, бл. 272 с изцяло южно изложение. Този блок е един от последните изградени панелни блокове в София.
Жилището е на седми етаж от общо девет етажа и с площ от 45 кв.м. Към него и прилежащо мазе от около 3 кв.м. Има и разположен паркинг, в който новият собственик ще има възможност свободно да паркира автомобила си. Апартаментът е със следното функционално разпределение: широк коридор, кухня изнесена на терасата, дневна, самостоятелна спалня и баня с тоалетна. Той е изцяло саниран и е с изключително ниски консумативни разходи. Сменена е дограмата и входната врата, а входът на блока е с контролиран достъп.
Местоположението на сградата е отлично, в непосредствена близост до имота се намират магазини, училища, детски градини, метростанция ""Хан Кубрат"", аптеки, заведения, фитнес салони, парк и всички необходими удобства за един комфортен начин на живот.
Това е имот, който си заслужава да видите и да закупите за свой собствен дом или за инвестиция с висока доходност.
Оферта № 11299
За повече информация, позвънете на тел.: 0883 97 79 79, или ни посетете на: www.martins.bg.
"
60m²,"жк. Надежда 2, София",False,"89,990",EUR,Обзаведен,4-ти,4,Локално отопление,,Панел,,,,,,,,,,,"Имоти Премиер представя на Вашето внимание двустаен апартамент в кв. Надежда 2. Жилището е преустроено в тристайно и разполага с входно антре, кухня, преустроена на спалня, хол с кухненски бокс, спалня и тераса. Покривът е ремонтиран. Блокът е на комуникативно място в близост до училища,спирки на градски транспорт и големи хранителни вериги.

Код на обявата: 343352"
68m²,"жк. Надежда 2, София",False,"104,000",EUR,Обзаведен,1-ви,8,ТЕЦ,,Панел,,,,,,,,,,,"Имоти Премиер представя на Вашето внимание двустаен апартамент в жк. Надежда 2. Жилището е на първиви висок етаж и се състои от:

Две спални, голям хол, кухня от присвоен балкон с трапезария, килер и голямо мазе. Имотът се намира на много комуникативно , но същевременно тихо място.

КОД НА ОБЯВАТА:337014"
125m²,"жк. Надежда 2, София",False,"150,000",EUR,Необзаведен,2-ри,9,ТЕЦ,,Тухла,,,,,,,,,,,"ДРИЙМ ВИЖЪН НЕДВИЖИМИ ИМОТИ Продава тристаен апартамент кв. Надежда 2 с бонус тераса 88 кв.м. Жилището се намира в новостояща се сграда, разположена на много комуникативно място с бърза връзка до центъра на града чрез бул. Ломско шосе.В близост има две метростанции, множество спирки на градски транспорт, хипермаркети, множество помещения от обслужващият сектор, две детска градини, училище, Северен парк. Жилището се състои от входно антре, просторна дневна с трапезария и кухненски бокс,две спални, баня с тоалетна, отделна тоалетна, мокро помещение, голяма тераса. Предава се на шпакловка и замазка. Качествено строителство от доказал се строител с множество завършени обекти. Възможност за покупка на подземен гараж. Оферта в агенцията 9253. Всички наши обяви ги работим с колеги. Още наши оферти може да намерите на www.dreamvision.bg Телефони за връзка: 02 421 96 35 ; 0886 13 22 91 Димитър Георгиев
"
85m²,"жк. Надежда 2, София",False,"136,000",EUR,,5-ти,5,,,Тухла,,,,,,,,,,,"ДРИЙМ ВИЖЪН НЕДВИЖИМИ ИМОТИ Продава двустаен апартамент завършен до ключ в кв. Надежда 2 на комуникативно място в близост до метростанция, спирки на градски транспорт, магазини, заведения. Нова луксозна сграда с предстоящ Акт 16 пролетта 2023г. Жилището се състои от: входно антре, дневна с кухненски бокс и трапезария, спалня, баня с тоалетна, тераса. Възможност за закупуване на паркомясто или гараж. Оферта в агенцията 9047. Всички наши обяви ги работим с колеги. Още наши оферти може да намерите на www.dreamvision.bg Телефон за връзка: 0885 98 11 00 - Александър Гогов
"
70m²,"жк. Надежда 2, София",False,"97,356",EUR,,2-ри,6,Локално отопление,,Тухла,,,,,,,,,,,"ДРИЙМ ВИЖЪН НЕДВИЖИМИ ИМОТИ Продава двустаен апартамент в кв. Надежда 2 на комуникативно място в близост до метростанция, спирки на градски транспорт, магазини, заведения. Малка бутикова сграда със само 13 апартамента в нея! Луксозни общи части. Жилището се състои от: входно антре, дневна с кухненски бокс и трапезария, спалня, баня с тоалетна, тераса. С югозападно изложение! Отоплението е предвидено на ток. Към апартамента има и мазе! Възможност за допълнително закупуване на външно/вътрешно паркомясто или гараж! В сградата предлагаме и други апартаменти! Оферта в агенцията 8963. Всички наши обяви ги работим с колеги. Още наши оферти може да намерите на www.dreamvision.bg Телефон за връзка: 0885 98 11 00 - Александър Гогов"
90m²,"жк. Надежда 2, София",False,"125,188",EUR,Необзаведен,2-ри,6,Локално отопление,,Тухла,,,,,,,,,,,"ДРИЙМ ВИЖЪН НЕДВИЖИМИ ИМОТИ Продава тристаен апартамент в кв. Надежда 2 на комуникативно място в близост до метростанция, спирки на градски транспорт, магазини, заведения. Малка бутикова сграда със само 13 апартамента в нея! Луксозни общи части. Жилището се състои от: входно антре, дневна с кухненски бокс и трапезария, две спални, баня с тоалетна, тоалетна, тераса. С югоизточно изложение! Отоплението е предвидено на ток. Към апартамента има и мазе! Възможност за допълнително закупуване на външно/вътрешно паркомясто или гараж! В сградата предлагаме и други апартаменти! Оферта в агенцията 8964. Всички наши обяви ги работим с колеги. Още наши оферти може да намерите на www.dreamvision.bg Телефон за връзка: 0885 98 11 00 - Александър Гогов"
65m²,"жк. Надежда 2, София",False,"90,215",EUR,Необзаведен,4-ти,6,Електричество,,Тухла,,,,,,,,,,,"ДРИЙМ ВИЖЪН НЕДВИЖИМИ ИМОТИ Продава двустаен апартамент в кв. Надежда 2 на комуникативно място в близост до метростанция, спирки на градски транспорт, магазини, заведения. Малка бутикова сграда със само 13 апартамента в нея! Луксозни общи части. Жилището се състои от: входно антре, дневна с кухненски бокс и трапезария, спалня, баня с тоалетна, тераса. С югозападно изложение! Отоплението е предвидено на ток. Към апартамента има и мазе! Възможност за допълнително закупуване на външно/вътрешно паркомясто или гараж! В сградата предлагаме и други апартаменти! Оферта в агенцията 8961. Всички наши обяви ги работим с колеги. Още наши оферти може да намерите на www.dreamvision.bg Телефон за връзка: 0885 98 11 00 - Александър Гогов
"
47m²,"жк. Надежда 2, София",False,"71,000",EUR,Необзаведен,2-ри,7,,,Панел,,,,,,,,,,,"Номер в агенцията 39081
Агенция И Консултинг продава класическа Гарсониера в Надежда 2. Намира се до ДГ Дора Габе. Жилището е вътрешно, състои се от: антре, хол, спалня, баня с тоалетна. Апартаментът е за Ремонт. 
За контакти Иван Иванов 0896977866
Разгледайте и другите ни предложения 
www.iconsulting-bg.com"
86m²,"жк. Надежда 2, София",False,"125,000",EUR,,6-ти,6,,,Тухла,,,,,,,,,,,"ЕКСКЛУЗИВНО ПРЕДЛОЖЕНИЕ!!!МАЛОМЕРЕН ТРИСТАЕН АПАРТАМЕНТ НА 5 МИН.ОТ МЕТРОСТАНЦИЯ!!! Утвърден строител с множество успешни проекта!!!Сградата се намира се на тиха улица в близост до училище и детска градина Апартаментът се намира на 6-ти етаж.Общата площ на апартамента е 86,00кв.м.Апартамента се издава на ш/з, PVC-дограма, външна топлоизолация, входна блиндирана врата.Отопление: Ток. Изложение: изток/югозапад. Прозорци 'Велукс'. Разпределение: коридор, просторна дневна с трапезария и кухненски бокс(26кв.м.), спалня, детска стая, тераса (14кв.м.), баня с тоалетна. Изградени са електро и водопроводната инсталация. Вътрешното пространство e функционално организирано. ВЪЗМОЖНОСТ ЗА ЗАКУПУВАНЕ НА ГОЛЯМ НАДЗЕМЕН ГАРАЖ!!!ОБЯВЕНИТЕ ЦЕНИ СА С ВКЛЮЧЕНО ДДС!!!ПРИ НАС МОЖЕ ДА СЕ ВЪЗПОЛЗВАТЕ от безплатна консултация с независим кредитен консултант и да получите най-добрите условия за вашия ипотечен кредит!!! Агенцията работи с комисионна. ЛЪКИ НЕДВИЖИМИ ИМОТИ моб.тел. 0884 688 866. Всички наши оферти ги работим с КОРЕКТНИ КОЛЕГИ! Виж по-малко... Виж повече"
86m²,"жк. Надежда 2, София",False,"125,000",EUR,,6-ти,6,,,Тухла,,,,,,,,,,,"ЕКСКЛУЗИВНО ПРЕДЛОЖЕНИЕ!!!МАЛОМЕРЕН ТРИСТАЕН АПАРТАМЕНТ НА 5 МИН.ОТ МЕТРОСТАНЦИЯ!!! Утвърден строител с множество успешни проекта!!!Сградата се намира се на тиха улица в близост до училище и детска градина Апартаментът се намира на 6-ти етаж.Общата площ на апартамента е 86,00кв.м.Апартамента се издава на ш/з, PVC-дограма, външна топлоизолация, входна блиндирана врата.Отопление: Ток. Изложение: изток/югозапад. Прозорци 'Велукс'. Разпределение: коридор, просторна дневна с трапезария и кухненски бокс(26кв.м.), спалня, детска стая, тераса (14кв.м.), баня с тоалетна. Изградени са електро и водопроводната инсталация. Вътрешното пространство e функционално организирано. ВЪЗМОЖНОСТ ЗА ЗАКУПУВАНЕ НА ГОЛЯМ НАДЗЕМЕН ГАРАЖ!!!ОБЯВЕНИТЕ ЦЕНИ СА С ВКЛЮЧЕНО ДДС!!!ПРИ НАС МОЖЕ ДА СЕ ВЪЗПОЛЗВАТЕ от безплатна консултация с независим кредитен консултант и да получите най-добрите условия за вашия ипотечен кредит!!! Агенцията работи с комисионна. ЛЪКИ НЕДВИЖИМИ ИМОТИ моб.тел. 0884 688 866. Всички наши оферти ги работим с КОРЕКТНИ КОЛЕГИ! Виж по-малко... Виж повече"
