Размер,Адрес,Точен адрес,Цена,Валута,Обзавеждане,Етаж,Етажи,Отопление,Състояние,Строителство,Спални,Бани,Двор,Площ на парцела,В регулация,Предназначение,Виза,Разрешение за строеж,Категория,Тип,Oписание
160m²," Крайградски зони, София",True,"110,000",EUR,Обзаведен,2-ри,3,Локално отопление,,Тухла,,,,,,,,,,,"ЕКСКЛУЗИВ!!!    "" СКАЛА ДИ"" недвижими имоти  предлага  луксозен имот в самостоятелна триетажна сграда. 
Апартамента е тип мезонет. Разположен на втори и трети етаж над магазин в гр. Драгоман находящ се на 35км от гр. София по новата автомагистрала посока КПП Калотина.
Имота се намира на комуникативно място в града в близост до Общината, Административни сгради, Целодневната детска градина, в близост до Медицински център ,Парк и голям развеклателен комплекс.
Жилището  е със самостоятелен вход без ползване на общи части .
Състои се от две нива със застроена площ всеки по 74 кв.м, мазе 12 кв.м и подпокривно пространство.
Първи етаж е помещение работещо като кафе/аперитив. 
Самостоятелен вход към втори етаж. Луксозно ремонтиран с ново обзавеждане.
Всичко е дърво бял бор ръчна изработка. Дървото е сушено 6 месеца в сушилня срещу вредители.
Отопление: Мезонета разполага с локално парно с котле, а на първо ниво има и подово отопление и климатик. 

Разпределение:
Първо ниво: вътрешно антре със стълбище към горният етаж, кухненски бокс с трапезария ,всекидневна, тоалетна и складово помещение.
Второ ниво: коридор, три самостоятелни спални. голяма баня с тоалетна, мокро помещение,тераса с панорамна гледка.
Подпокривно пространство оформено като еднопространствено помещение,

Цялата сграда е санирана, сменени ВиК, Ел. Мрежа, изградена наново канализация.
Дограмата е ПВЦ от най-висок клас.Сменен покрив.Има Интернет,СОТ.
Свободно паркиране на улицата пред и около сградата.

Ако този имот представлява интерес обадете се и цитирайте този код:   КОД 25285

"
75m²," Крайградски зони, София",True,"74,800",EUR,Обзаведен,1-ви,3,Електричество,,Тухла,,,,,,,,,,,"СТИЛНО ОБЗАВЕДЕН, СЪС СОБСТВЕН ДВОР И МИНЕРАЛНА ВОДА, находящ се в жилищна сграда до известния х-л Виталис, в к.к. ’Пчелински бани’, отстоящ на 70км от София и Пловдив (по магистрала ’Тракия’), на 30км от Боровец и на 8км от гр. Костенец, в лоното на Средна гора! Апартаментът ви дава уникалната възможност да имате собствен Relax център с неограничен достъп до лечебните свойства на пчелинската термална минерална вода, която ЦЕЛОГОДИШНО ЗАХРАНВА БАНЯТА В АПАРТАМЕНТА! (60 градуса постоянно), а кристално чистата студена вода идва от Рилския водопровод, отоплението е решено посредством климатици и чудесна камина, състоянието е след основен ремонт, продава се заедно с цялостното обзавеждане и уреди, закупени и монтирани в края на 2020г, така както е видно от снимковия материал. Срещу годишна такса от 280лв, 4-членно семейство може да ползва 2 открити басейна с минерална вода, с температура около 36 градуса и 3-ти вътрешен покрит басейн (в хотела), която включва и таксите за интернет, кабелна телевизия и външна охрана, а за любителите на риболова, в близост се намира чудесният яз. ”Левица”. Разпределение - входно антре, разчупена дневна с трапезария и кухненски бокс, преходна спалня, баня с тоалетна и двор; ЗП 60кв.м.; двор 18кв.м.; общи части 11кв.м.; Изложение ЮГОИЗТОК! Башев 0888960399"
